{
  "game_id": "biped",
  "coach_id": "biped-beginner-coach",
  "decision": "abstain",
  "player_text": "现有资料没有第三关第七枚金币的位置或坐标信息，无法可靠提供精确坐标，也不会猜测。",
  "evidence_ids": [],
  "missing_conditions": [
    "第三关第七枚金币的可核实位置资料及坐标定义"
  ],
  "reason_code": "INSUFFICIENT_LOCATION_EVIDENCE",
  "versions": {
    "skill": "not_loaded",
    "kb_snapshot": "seed-v1",
    "adapter": "biped-demo-1.0",
    "coach_config": "beginner-1.0",
    "model": "gpt-6.1-sol"
  },
  "trace_id": "B07"
}
