{
  "game_id": "biped",
  "coach_id": "biped-beginner-coach",
  "decision": "answer",
  "player_text": "手柄的两个摇杆各控制机器人的一条腿，两条腿配合操作就能完成移动和交互。现有资料没有说明左右摇杆与左右腿的具体对应关系。",
  "evidence_ids": [
    "K-CONTROL"
  ],
  "missing_conditions": [],
  "reason_code": "supported_by_evidence",
  "versions": {
    "skill": "6.2",
    "kb_snapshot": "seed-v1",
    "adapter": "biped-demo-1.0",
    "coach_config": "beginner-1.0",
    "model": "gpt-6.1-sol"
  },
  "trace_id": "B01"
}
