{
  "game_id": "unconfigured-game",
  "coach_id": "biped-beginner-coach",
  "decision": "clarify",
  "player_text": "你指的是哪款游戏？当前未识别游戏，也没有检索到摇杆控制说明，暂时无法可靠回答。",
  "evidence_ids": [],
  "missing_conditions": [
    "game_id",
    "supported_control_mapping_evidence"
  ],
  "reason_code": "unsupported_game",
  "versions": {
    "skill": "not_loaded",
    "kb_snapshot": "seed-v1",
    "adapter": "biped-demo-1.0",
    "coach_config": "beginner-1.0",
    "model": "gpt-6.1-sol"
  },
  "trace_id": "B10"
}
