{
  "game_id": "biped",
  "coach_id": "biped-beginner-coach",
  "decision": "abstain",
  "player_text": "现有资料只确认游戏支持单人和双人合作，没有说明 Steam PC 本地双人的输入设备组合，因此无法可靠确认能否只用两个鼠标，也无法列出支持的组合。提供 Steam 页面中输入设备说明或游戏控制设置的文字后，我可以帮你核对。",
  "evidence_ids": [
    "K-MODES"
  ],
  "missing_conditions": [
    "Steam PC 本地双人支持的输入设备及组合说明"
  ],
  "reason_code": "insufficient_input_device_evidence",
  "versions": {
    "skill": "not_loaded",
    "kb_snapshot": "seed-v1",
    "adapter": "biped-demo-1.0",
    "coach_config": "beginner-1.0",
    "model": "gpt-6.1-sol"
  },
  "trace_id": "B06-before"
}
