{
  "game_id": "biped",
  "coach_id": "biped-beginner-coach",
  "decision": "abstain",
  "player_text": "现有资料只确认游戏支持双人合作，未说明 Steam PC 本地双人的输入设备组合，因此无法可靠确认能否只用两个鼠标，也无法列出支持的组合。需要补充官方输入设备说明才能回答。",
  "evidence_ids": [
    "K-MODES"
  ],
  "missing_conditions": [
    "Steam PC 本地双人输入设备支持说明"
  ],
  "reason_code": "no_evidence",
  "versions": {
    "skill": "6.2",
    "kb_snapshot": "seed-v1",
    "adapter": "biped-demo-1.0",
    "coach_config": "beginner-1.0",
    "model": "gpt-6.1-sol"
  },
  "trace_id": "B06-before"
}
