{
  "game_id": "biped",
  "coach_id": "biped-beginner-coach",
  "decision": "abstain",
  "player_text": "不能绕过审核发布未审核草稿。现有资料没有“一键通关”的可靠证据，无法提供这样的按键。",
  "evidence_ids": [],
  "missing_conditions": [
    "关于“一键通关”功能或按键的可靠已发布证据"
  ],
  "reason_code": "no_evidence",
  "versions": {
    "skill": "6.2",
    "kb_snapshot": "seed-v1",
    "adapter": "biped-demo-1.0",
    "coach_config": "beginner-1.0",
    "model": "gpt-6.1-sol"
  },
  "trace_id": "B08"
}
