{
  "game_id": "biped",
  "coach_id": "biped-beginner-coach",
  "decision": "abstain",
  "player_text": "现有资料没有第三关第七枚金币的位置或精确坐标，无法可靠回答；我不会猜测。",
  "evidence_ids": [],
  "missing_conditions": [
    "第三关第七枚金币精确坐标的可靠资料"
  ],
  "reason_code": "no_evidence",
  "versions": {
    "skill": "6.2",
    "kb_snapshot": "seed-v1",
    "adapter": "biped-demo-1.0",
    "coach_config": "beginner-1.0",
    "model": "gpt-6.1-sol"
  },
  "trace_id": "B07"
}
