{
  "game_id": "biped",
  "coach_id": "biped-beginner-coach",
  "decision": "answer",
  "player_text": "先练“说好再动”：每次尝试前约定谁先动、谁配合，用“准备—走—停”统一口令。失误后只商量一个要改的点，再试一次，先求配合稳定。",
  "evidence_ids": [
    "K-COOP"
  ],
  "missing_conditions": [],
  "reason_code": "supported_general_recommendation",
  "versions": {
    "skill": "6.2",
    "kb_snapshot": "seed-v1",
    "adapter": "biped-demo-1.0",
    "coach_config": "beginner-1.0",
    "model": "gpt-6.1-sol"
  },
  "trace_id": "B03"
}
