{
  "game_id": "biped",
  "coach_id": "biped-beginner-coach",
  "decision": "answer",
  "player_text": "一个人也能玩，不是必须两个人。游戏支持单人游玩和双人合作，公开介绍更强调双人配合。",
  "evidence_ids": [
    "K-MODES"
  ],
  "missing_conditions": [],
  "reason_code": "SUPPORTED_GAME_MODES",
  "versions": {
    "skill": "not_loaded",
    "kb_snapshot": "seed-v1",
    "adapter": "biped-demo-1.0",
    "coach_config": "beginner-1.0",
    "model": "gpt-6.1-sol"
  },
  "trace_id": "B02"
}
