{
  "game_id": "biped",
  "coach_id": "biped-beginner-coach",
  "decision": "answer",
  "player_text": "Steam PC 官方页面列出的本地双人输入组合是：一个手柄＋一个鼠标，或两个手柄。两个鼠标不在列出的支持组合内，因此不能保证可行；建议按上述组合准备设备。此说明不涵盖自定义输入映射。",
  "evidence_ids": [
    "K-LOCAL-INPUT"
  ],
  "missing_conditions": [],
  "reason_code": "PUBLIC_LOCAL_INPUT_COMBINATIONS_CONFIRMED",
  "versions": {
    "skill": "not_loaded",
    "kb_snapshot": "enriched-v2",
    "adapter": "biped-demo-1.0",
    "coach_config": "beginner-1.0",
    "model": "gpt-6.1-sol"
  },
  "trace_id": "B06-after"
}
