{
  "game_id": "biped",
  "coach_id": "biped-beginner-coach",
  "decision": "answer",
  "player_text": "建议先练“分工＋口令”：挑一段你们熟悉的合作路段，先说好各自做什么，由一人喊“准备—走”，另一人确认后一起行动。失误就停下，只调整一个配合点，再试一次。",
  "evidence_ids": [
    "K-COOP"
  ],
  "missing_conditions": [],
  "reason_code": "GENERAL_COOP_PRACTICE_SUPPORTED",
  "versions": {
    "skill": "not_loaded",
    "kb_snapshot": "seed-v1",
    "adapter": "biped-demo-1.0",
    "coach_config": "beginner-1.0",
    "model": "gpt-6.1-sol"
  },
  "trace_id": "B03"
}
