{
  "game_id": "biped",
  "coach_id": "biped-beginner-coach",
  "decision": "clarify",
  "player_text": "目前缺少具体机关和站位信息，无法可靠判断下一脚。你们在哪一关、遇到什么机关，两人分别站在哪里，机关现在是什么状态？",
  "evidence_ids": [
    "K-COOP"
  ],
  "missing_conditions": [
    "level_or_mechanism",
    "player_positions",
    "mechanism_state"
  ],
  "reason_code": "state_missing",
  "versions": {
    "skill": "6.2",
    "kb_snapshot": "seed-v1",
    "adapter": "biped-demo-1.0",
    "coach_config": "beginner-1.0",
    "model": "gpt-6.1-sol"
  },
  "trace_id": "B04"
}
