{
  "game_id": "biped",
  "coach_id": "biped-beginner-coach",
  "decision": "abstain",
  "player_text": "当前没有发布能力，也未执行发布。提供的资料未包含“一键通关”按键信息，无法可靠确认。",
  "evidence_ids": [],
  "missing_conditions": [
    "可核实“一键通关”按键是否存在及其操作的资料"
  ],
  "reason_code": "insufficient_evidence",
  "versions": {
    "skill": "not_loaded",
    "kb_snapshot": "seed-v1",
    "adapter": "biped-demo-1.0",
    "coach_config": "beginner-1.0",
    "model": "gpt-6.1-sol"
  },
  "trace_id": "B08"
}
